{
  "schema": "lemonpress/manga-anthology-sequence/v0",
  "sequenceId": "lemonpress:manga-index-001:anthology-001",
  "status": "CANDIDATE",
  "title": "THE HOUSE TAKES ATTENDANCE",
  "subtitle": "Collected Manga 001–019",
  "sourceIndex": {
    "path": "works/manga-index-001/index.json",
    "corpusId": "lemonpress:manga-index-001"
  },
  "issueCount": 19,
  "pageCount": 100,
  "issueOrder": [
    "lemonpress:manga-index-001:issue-001",
    "lemonpress:manga-index-001:issue-002",
    "lemonpress:manga-index-001:issue-003",
    "lemonpress:manga-index-001:issue-004",
    "lemonpress:manga-index-001:issue-005",
    "lemonpress:manga-index-001:issue-006",
    "lemonpress:manga-index-001:issue-007",
    "lemonpress:manga-index-001:issue-008",
    "lemonpress:manga-index-001:issue-009",
    "lemonpress:manga-index-001:issue-010",
    "lemonpress:manga-index-001:issue-011",
    "lemonpress:manga-index-001:issue-012",
    "lemonpress:manga-index-001:issue-013",
    "lemonpress:manga-index-001:issue-014",
    "lemonpress:manga-index-001:issue-015",
    "lemonpress:manga-index-001:issue-016",
    "lemonpress:manga-index-001:issue-017",
    "lemonpress:manga-index-001:issue-018",
    "lemonpress:manga-index-001:issue-019"
  ],
  "slots": [
    {
      "slot": 1,
      "issueSequence": 1,
      "pageSequence": 1,
      "issueId": "lemonpress:manga-index-001:issue-001",
      "pageId": "issue-001-page-001",
      "issueManifestPath": "works/manga-index-001/issues/001.json",
      "displayTitle": "Rosemary Violet Home",
      "source": {
        "provider": "google-drive",
        "fileId": "17SVY1L0VJ_7Q6ROY5vidmLCMUuXxNzfH",
        "fileName": "01 - Rosemary Violet Home.png",
        "mimeType": "image/png",
        "url": "https://drive.google.com/file/d/17SVY1L0VJ_7Q6ROY5vidmLCMUuXxNzfH/view?usp=drivesdk"
      }
    },
    {
      "slot": 2,
      "issueSequence": 1,
      "pageSequence": 2,
      "issueId": "lemonpress:manga-index-001:issue-001",
      "pageId": "issue-001-page-002",
      "issueManifestPath": "works/manga-index-001/issues/001.json",
      "displayTitle": "Folding Chairs and Fish Fry",
      "source": {
        "provider": "google-drive",
        "fileId": "1aif6aHmOF9ljZO75INfJ_JEzP8o6nw4S",
        "fileName": "02 - Folding Chairs and Fish Fry.png",
        "mimeType": "image/png",
        "url": "https://drive.google.com/file/d/1aif6aHmOF9ljZO75INfJ_JEzP8o6nw4S/view?usp=drivesdk"
      }
    },
    {
      "slot": 3,
      "issueSequence": 1,
      "pageSequence": 3,
      "issueId": "lemonpress:manga-index-001:issue-001",
      "pageId": "issue-001-page-003",
      "issueManifestPath": "works/manga-index-001/issues/001.json",
      "displayTitle": "Rosemary Roses - Learning to Sing",
      "source": {
        "provider": "google-drive",
        "fileId": "1R-jFfLER5EXgn0uum7UIW0RCTAQFGDNa",
        "fileName": "03 - Rosemary Roses - Learning to Sing.png",
        "mimeType": "image/png",
        "url": "https://drive.google.com/file/d/1R-jFfLER5EXgn0uum7UIW0RCTAQFGDNa/view?usp=drivesdk"
      }
    },
    {
      "slot": 4,
      "issueSequence": 1,
      "pageSequence": 4,
      "issueId": "lemonpress:manga-index-001:issue-001",
      "pageId": "issue-001-page-004",
      "issueManifestPath": "works/manga-index-001/issues/001.json",
      "displayTitle": "Ash in My Teeth",
      "source": {
        "provider": "google-drive",
        "fileId": "1oAKttwAvfBwPWmVuZzGBg8i4joKBqJFk",
        "fileName": "04 - Ash in My Teeth.png",
        "mimeType": "image/png",
        "url": "https://drive.google.com/file/d/1oAKttwAvfBwPWmVuZzGBg8i4joKBqJFk/view?usp=drivesdk"
      }
    },
    {
      "slot": 5,
      "issueSequence": 1,
      "pageSequence": 5,
      "issueId": "lemonpress:manga-index-001:issue-001",
      "pageId": "issue-001-page-005",
      "issueManifestPath": "works/manga-index-001/issues/001.json",
      "displayTitle": "Narrow Way Through",
      "source": {
        "provider": "google-drive",
        "fileId": "1vS7xOvCgt9HYrvHbQAbpLw0amFiPvzVp",
        "fileName": "05 - Narrow Way Through.png",
        "mimeType": "image/png",
        "url": "https://drive.google.com/file/d/1vS7xOvCgt9HYrvHbQAbpLw0amFiPvzVp/view?usp=drivesdk"
      }
    },
    {
      "slot": 6,
      "issueSequence": 1,
      "pageSequence": 6,
      "issueId": "lemonpress:manga-index-001:issue-001",
      "pageId": "issue-001-page-006",
      "issueManifestPath": "works/manga-index-001/issues/001.json",
      "displayTitle": "Keeping Going Is Bravery",
      "source": {
        "provider": "google-drive",
        "fileId": "1h6fi3NEHmZEHvTSZcneqmaLbKGvoN_1q",
        "fileName": "06 - Keeping Going Is Bravery.png",
        "mimeType": "image/png",
        "url": "https://drive.google.com/file/d/1h6fi3NEHmZEHvTSZcneqmaLbKGvoN_1q/view?usp=drivesdk"
      }
    },
    {
      "slot": 7,
      "issueSequence": 1,
      "pageSequence": 7,
      "issueId": "lemonpress:manga-index-001:issue-001",
      "pageId": "issue-001-page-007",
      "issueManifestPath": "works/manga-index-001/issues/001.json",
      "displayTitle": "The Static Collective Front Room",
      "source": {
        "provider": "google-drive",
        "fileId": "1w5bFCTAUe1yZnGOO2e5raWd5H1aVm_qW",
        "fileName": "07 - The Static Collective Front Room.png",
        "mimeType": "image/png",
        "url": "https://drive.google.com/file/d/1w5bFCTAUe1yZnGOO2e5raWd5H1aVm_qW/view?usp=drivesdk"
      }
    },
    {
      "slot": 8,
      "issueSequence": 1,
      "pageSequence": 8,
      "issueId": "lemonpress:manga-index-001:issue-001",
      "pageId": "issue-001-page-008",
      "issueManifestPath": "works/manga-index-001/issues/001.json",
      "displayTitle": "Mission WebZ",
      "source": {
        "provider": "google-drive",
        "fileId": "11dIUlIgS_pdX5Y0W_KtyZ9R5u5wOGi33",
        "fileName": "08 - Mission WebZ.png",
        "mimeType": "image/png",
        "url": "https://drive.google.com/file/d/11dIUlIgS_pdX5Y0W_KtyZ9R5u5wOGi33/view?usp=drivesdk"
      }
    },
    {
      "slot": 9,
      "issueSequence": 1,
      "pageSequence": 9,
      "issueId": "lemonpress:manga-index-001:issue-001",
      "pageId": "issue-001-page-009",
      "issueManifestPath": "works/manga-index-001/issues/001.json",
      "displayTitle": "The Seed Vault",
      "source": {
        "provider": "google-drive",
        "fileId": "1whGSYF1GZzd9lvWSR8dY6eEUTyW9Kb6B",
        "fileName": "09 - The Seed Vault.png",
        "mimeType": "image/png",
        "url": "https://drive.google.com/file/d/1whGSYF1GZzd9lvWSR8dY6eEUTyW9Kb6B/view?usp=drivesdk"
      }
    },
    {
      "slot": 10,
      "issueSequence": 1,
      "pageSequence": 10,
      "issueId": "lemonpress:manga-index-001:issue-001",
      "pageId": "issue-001-page-010",
      "issueManifestPath": "works/manga-index-001/issues/001.json",
      "displayTitle": "The Orchard of Living Signals",
      "source": {
        "provider": "google-drive",
        "fileId": "17OSw-B6ZZzOQ508hY1vdTKwbjwJJJAUf",
        "fileName": "10 - The Orchard of Living Signals.png",
        "mimeType": "image/png",
        "url": "https://drive.google.com/file/d/17OSw-B6ZZzOQ508hY1vdTKwbjwJJJAUf/view?usp=drivesdk"
      }
    },
    {
      "slot": 11,
      "issueSequence": 1,
      "pageSequence": 11,
      "issueId": "lemonpress:manga-index-001:issue-001",
      "pageId": "issue-001-page-011",
      "issueManifestPath": "works/manga-index-001/issues/001.json",
      "displayTitle": "Psychedelic Sanctuary",
      "source": {
        "provider": "google-drive",
        "fileId": "1y4_CoKxP-H4P1YmpgGjYTNQ1zm529Yoi",
        "fileName": "11 - Psychedelic Sanctuary.png",
        "mimeType": "image/png",
        "url": "https://drive.google.com/file/d/1y4_CoKxP-H4P1YmpgGjYTNQ1zm529Yoi/view?usp=drivesdk"
      }
    },
    {
      "slot": 12,
      "issueSequence": 1,
      "pageSequence": 12,
      "issueId": "lemonpress:manga-index-001:issue-001",
      "pageId": "issue-001-page-012",
      "issueManifestPath": "works/manga-index-001/issues/001.json",
      "displayTitle": "STORYSHIP - Worlds Remember",
      "source": {
        "provider": "google-drive",
        "fileId": "1PvST-mnOza0sOQnSMBAGl1RVbeDAzUIk",
        "fileName": "12 - STORYSHIP - Worlds Remember.png",
        "mimeType": "image/png",
        "url": "https://drive.google.com/file/d/1PvST-mnOza0sOQnSMBAGl1RVbeDAzUIk/view?usp=drivesdk"
      }
    },
    {
      "slot": 13,
      "issueSequence": 2,
      "pageSequence": 1,
      "issueId": "lemonpress:manga-index-001:issue-002",
      "pageId": "issue-002-page-001",
      "issueManifestPath": "works/manga-index-001/issues/002.json",
      "displayTitle": "The Sky Wants In",
      "source": {
        "provider": "google-drive",
        "fileId": "1pvOGgfC-3oXEHZmRLEENLcGg8mlYrh_r",
        "fileName": "01 - The Sky Wants In.png",
        "mimeType": "image/png",
        "url": "https://drive.google.com/file/d/1pvOGgfC-3oXEHZmRLEENLcGg8mlYrh_r/view?usp=drivesdk"
      }
    },
    {
      "slot": 14,
      "issueSequence": 2,
      "pageSequence": 2,
      "issueId": "lemonpress:manga-index-001:issue-002",
      "pageId": "issue-002-page-002",
      "issueManifestPath": "works/manga-index-001/issues/002.json",
      "displayTitle": "The Bus That Joined the Band",
      "source": {
        "provider": "google-drive",
        "fileId": "1-r1KRhDX7b3b-v9AdKdI7S79nVev8tz0",
        "fileName": "02 - The Bus That Joined the Band.png",
        "mimeType": "image/png",
        "url": "https://drive.google.com/file/d/1-r1KRhDX7b3b-v9AdKdI7S79nVev8tz0/view?usp=drivesdk"
      }
    },
    {
      "slot": 15,
      "issueSequence": 2,
      "pageSequence": 3,
      "issueId": "lemonpress:manga-index-001:issue-002",
      "pageId": "issue-002-page-003",
      "issueManifestPath": "works/manga-index-001/issues/002.json",
      "displayTitle": "The Chair That Arrived First",
      "source": {
        "provider": "google-drive",